{
  "schemaVersion": 1,
  "libraryId": "00000000-0000-4000-8000-000000000001",
  "assetId": "00000000-0000-4000-8000-000000000101",
  "revision": 1,
  "parentRevision": null,
  "operationId": "00000000-0000-4000-8000-000000000201",
  "createdAt": "2026-10-06T19:00:00Z",
  "importedAt": "2026-10-06T18:59:52Z",
  "captureTime": "2026-09-08T18:42:11Z",
  "blobs": [
    {
      "blobId": "00000000-0000-4000-8000-000000000301",
      "role": "ORIGINAL_JPEG",
      "objectKey": "objects/aaaaaaaaaaaaaaaaaaaaaaaaaaaaaaaaaaaaaaaaaaaaaaaaaaaaaaaaaaaaaaaa",
      "originalFilename": "IMG_0001.JPG",
      "sha256": "aaaaaaaaaaaaaaaaaaaaaaaaaaaaaaaaaaaaaaaaaaaaaaaaaaaaaaaaaaaaaaaa",
      "sizeBytes": 183421,
      "mimeType": "image/jpeg"
    },
    {
      "blobId": "00000000-0000-4000-8000-000000000302",
      "role": "SIDECAR",
      "objectKey": "objects/bbbbbbbbbbbbbbbbbbbbbbbbbbbbbbbbbbbbbbbbbbbbbbbbbbbbbbbbbbbbbbbb",
      "originalFilename": "IMG_0001.xmp",
      "sha256": "bbbbbbbbbbbbbbbbbbbbbbbbbbbbbbbbbbbbbbbbbbbbbbbbbbbbbbbbbbbbbbbb",
      "sizeBytes": 932,
      "mimeType": "application/rdf+xml"
    }
  ],
  "primaryBlobId": "00000000-0000-4000-8000-000000000301",
  "extractedMetadata": {"Make": "Example Camera", "Model": "Example 1"},
  "userState": {"rating": 4, "favorite": true, "caption": "Trailhead", "keywords": ["hike"], "location": null},
  "deletedAt": null,
  "processing": []
}
